,_id,ltable_id,rtable_id,ltable_title,ltable_artist_name,ltable_year,rtable_title,rtable_year,rtable_episode,rtable_song,rtable_artists
528601,528601,651861,367127,Optimistic,Skeeter Davis,1995,Big Eden,2000.0,,Optimistic,aubrey freeman skeeter davis
529495,529495,385066,208611,Ain't Got No Money,20th Century Steel Band,0,Shameless,2011.0,Survival of the Fittest (#3.12),The Money Goes,the reverend peytons big damn band
531606,531606,560938,534169,Could You Be Loved,Bob Marley & The Wailers,1995,Marley,2012.0,,Could You Be Loved,bob marley the wailers
532708,532708,651586,138862,Five Piano Improvisations (1993 Digital Remaster): No. 1,Sir Edward Elgar,0,Lilyhammer,2012.0,My Kind of Town (#1.5),GymnopÃŒÂ©die No 1  Lent et douloureux,eric satie sir peter maxwell davies ronan ohora
532841,532841,57633,629878,My Baby Came Back On The Last Wave Today,The Malibooz,0,Step Into Liquid,2003.0,,Call of the Wave,malibooz
534083,534083,961264,462088,Duke of Earl,Gene Chandler,1961,Hairspray,1988.0,,Duke of Earl,earl edwards gene chandler bernice williams
535655,535655,279276,557772,Here Comes The Night,Drive Like Maria feat. Janis Ian,2009,Nitro Circus: The Movie,2012.0,,Silent Night,ian a lover luftshansia
537479,537479,137367,421485,What I Almost Was,Eric Church,2006,Dream a Dream: Charlotte Church in the Holy Land,2000.0,,What Child Is This,william chatterton dix charlotte church
538671,538671,60232,162997,Fantastic That's You,Oliver Nelson,1966,Mystery Science Theater 3000,1988.0,Girls Town (#7.1),Thats the Way (I Like It),harry wayne casey richard finch michael j. nelson
538732,538732,745179,162997,Way Down,Marty Stuart And His Fabulous Superlatives / Handsome Harry,2005,Mystery Science Theater 3000,1988.0,Girls Town (#7.1),Thats the Way (I Like It),harry wayne casey richard finch michael j. nelson
539220,539220,840479,517935,I Fill All of Your Dreams,Wild Billy Childish And The Musicians Of The British Empire,2008,License to Drive,1988.0,,GET OUTTA MY DREAMS  GET INTO MY CAR,robert john lange billy ocean
541021,541021,853810,534597,Life Goes On (Megaloids Mix [The New Speed Garage]),Richard Grey vs Erick Morillo & Jose Nunez featuring Shawnee Taylor,0,Mary Poppins,1964.0,,The Life I Lead,richard m. sherman robert b. sherman david tomlinson
541626,541626,147129,708152,See You On Rooftops (US Radio Edit),Neil Halstead,0,Uncharted 2: Among Thieves IGN Podcast Beyond,2011.0,,Love Will Keep Us Together,captain tennille neil sedaka
542857,542857,895472,617716,Check-It,Skream ft. Warrior Queen,2006,Sket,2011.0,,Check-It,skream warrior queen
545467,545467,792077,320149,Bad Moon Rising,Creedence Clearwater Revival,1969,Witchblade,2001.0,Parabolic (#2.10),Bad Moon Rising,john fogerty creedence clearwater revival
546732,546732,712305,54001,New York_ New York (Main Theme),The Boston Pops Orchestra / John Williams,0,Curious George,2006.0,The All Animal Recycled Band/The Times of Sand (#1.27),Curious George Main Title Theme,dr. john rocco gagliese steve dangelo terry tompkins
547985,547985,614614,226175,Sing a Little Song,Desmond Dekker,1975,Stars in Their Eyes,1990.0,(#8.6),This Aint a Love Song,jon bon jovi richie sambora desmond child david burrows
551198,551198,572509,623434,Cathedral Wedding Song,Richard Wagner / Otto Sieben,0,Soolo suoraan sydÃŒ_mestÃŒ_,1983.0,,A Song for You,henrik otto donner
551481,551481,612839,30566,Hot Stuff,Donna Summer,1979,Big Brother,2000.0,,Hot Stuff,pete bellotte harold faltermeyer keith forsey donna summer
553120,553120,541671,225129,Main Title,Jerry Goldsmith,1966,Stargate SG-1,1997.0,Ascension (#5.3),Main Title,joel goldsmith david arnold
553688,553688,607072,498914,Suzanne (Every Night When The Sun Goes Down),Harry Belafonte,2001,Keep Your Seats  Please!,1936.0,,When Im Cleaning Windows,george formby harry gifford fred e. cliffe
554296,554296,727276,63609,Shine On Harvest Moon,Tiny Tim,0,Degrassi: The Next Generation,2001.0,Dont Panic: Part 2 (#11.25),I Love You Like The Night Loves The Moon,tim williams depression state trooper
554515,554515,682849,437006,Love Makes The World Go Round (LP Version),Tommy James & The Shondells,1966,Fast Break,1979.0,,Go for It (Disco),david shire james di pasquale billy preston syreeta
555195,555195,871241,11228,O Holy Night,The Mississippi Mass Choir,0,American Horror Story,2011.0,Unholy Night (#2.8),O Holy Night,north star boys choir
555212,555212,341064,11228,O Come All Ye Faithful,The London Community Gospel Choir,0,American Horror Story,2011.0,Unholy Night (#2.8),O Holy Night,north star boys choir
556567,556567,882827,332681,When Morning Comes,VIP Mass Choir featuring John P. Kee,0,A Disney Christmas Gift,1983.0,,On Christmas Morning,music: john debney
558645,558645,630088,28776,Muda De Vida,Humanos,2004,Bem-Vindos a Beirais,2013.0,(Re) ComeÃŒÂ¤os (#3.165),Muda de Vida,antÃŒ_nio variaÃŒÂ¤ÃŒÂµes humanos
558974,558974,258207,342874,Who Do You Think We Are (Album Version),Alice Cooper,1981,Alice Cooper ÃŒÃŠ Paris,1982.0,,Who Do You Think We Are? (reprise),alice cooper duane hitchings
559491,559491,27221,437150,Turn The Heat Up,Phil Perry / Lee Ritenour / Eric R. Tagg / Paulinho Costa / Phil Perry / Eric Tagg / Larry Williams,0,Fast Money,2006.0,,Get Up,r. kim aka chan
560813,560813,877553,299967,When I Pull Up At The Club,Three 6 Mafia feat. Paul Wall,0,Top of the Pops,1964.0,(1978-09-21),Givin Up Givin In,giorgio moroder pete bellotte the three degrees
561323,561323,889895,203227,Late Last Night,Sara Martin,0,Saturday Night Live,1975.0,Steve Martin/Jason Mraz (#34.14),Late For School,steve martin
562343,562343,536849,91103,So Alive,Ann Lee,0,Fraggle Rock,1983.0,Dont Cry Over Spilt Milk (#1.10),Feel So Bad,philip balsam dennis lee steve whitmire dave goelz kathryn mullen karen prell
566622,566622,481898,212559,Todo es mentira,CafÌ© Quijano,2003,Silicon Valley,2014.0,Signaling Risk (#1.5),Todo Mi Vida,pueblo cafÃŒÂ©
567735,567735,885818,396041,When The Bed Breaks Down_ I'll Meet You In The Spring,Incredible Bongo Band,1973,Comedian,2002.0,,When I Paint My Masterpiece,bob dylan the band
568170,568170,431924,536554,Strings For Yasmin (Reprise),Tin Tin Out,1998,Mean Machine,2001.0,,Strings for Yasmin,lindasy edwards darren stokes tin tin out
